{
  "schema_version": 1,
  "status": "verified",
  "identity": {
    "vendor": "openai",
    "api_product": "OpenAI direct API Standard",
    "upstream_model": "gpt-6-astra",
    "aliases": [
      "gpt-latest",
      "gpt-6-astra"
    ],
    "account_context": null,
    "region": "global",
    "routes": [
      "completion",
      "responses"
    ]
  },
  "sources": [
    {
      "url": "https://developers.openai.com/api/docs/pricing",
      "retrieved_at": "2026-09-16T00:00:00Z",
      "scope": "pricing",
      "excerpt": ""
    },
    {
      "url": "https://developers.openai.com/api/docs/models/gpt-6-astra",
      "retrieved_at": "2026-09-16T00:00:00Z",
      "scope": "usage_schema",
      "excerpt": ""
    }
  ],
  "retrieved_at": "2026-09-16T00:00:00Z",
  "effective_from": null,
  "effective_to": null,
  "currency": "USD",
  "rate_basis": "posted_api_rate",
  "dimensions": [
    {
      "name": "input_tokens",
      "unit": "token",
      "rate": "10",
      "per": "1000000",
      "conditions": {
        "service_tier": "default",
        "long_context": {
          "usage": "total_input_tokens",
          "above": "272000",
          "rate": "20"
        }
      }
    },
    {
      "name": "cached_tokens",
      "unit": "token",
      "rate": "1",
      "per": "1000000",
      "conditions": {
        "service_tier": "default",
        "long_context": {
          "usage": "total_input_tokens",
          "above": "272000",
          "rate": "2"
        }
      }
    },
    {
      "name": "cache_write_tokens",
      "unit": "token",
      "rate": "12.50",
      "per": "1000000",
      "conditions": {
        "service_tier": "default",
        "long_context": {
          "usage": "total_input_tokens",
          "above": "272000",
          "rate": "25.00"
        }
      }
    },
    {
      "name": "output_tokens",
      "unit": "token",
      "rate": "50",
      "per": "1000000",
      "conditions": {
        "service_tier": "default",
        "long_context": {
          "usage": "total_input_tokens",
          "above": "272000",
          "rate": "75.0"
        }
      }
    }
  ],
  "calculation": {
    "usage": {
      "input_tokens": "1000",
      "cached_tokens": "0",
      "cache_write_tokens": "0",
      "output_tokens": "0"
    },
    "formula": "1000 * 10 / 1000000",
    "calculated_cost": "0.01",
    "provider_reported_cost": null,
    "evidence_kind": "synthetic"
  },
  "differences": [],
  "limitations": [
    "Public Standard pricing only; account contract and provider-backed route fixtures remain outstanding.",
    "Hosted tool costs, Batch, Flex, Fast and regional premiums are separate profiles and not admitted by this profile.",
    "Current verification does not authorize historical repricing."
  ]
}
