{
  "schema_version": 1,
  "status": "verified",
  "identity": {
    "vendor": "openai",
    "api_product": "OpenAI direct API Fast",
    "upstream_model": "gpt-6-astra",
    "aliases": [
      "gpt-latest",
      "gpt-6-astra"
    ],
    "account_context": null,
    "region": "global",
    "routes": [
      "completion",
      "responses"
    ]
  },
  "sources": [
    {
      "url": "https://developers.openai.com/api/docs/pricing",
      "retrieved_at": "2026-09-16T00:00:00Z",
      "scope": "pricing",
      "excerpt": ""
    },
    {
      "url": "https://developers.openai.com/api/docs/models/gpt-6-astra",
      "retrieved_at": "2026-09-16T00:00:00Z",
      "scope": "usage_schema",
      "excerpt": ""
    }
  ],
  "retrieved_at": "2026-09-16T00:00:00Z",
  "effective_from": null,
  "effective_to": null,
  "currency": "USD",
  "rate_basis": "posted_api_rate",
  "dimensions": [
    {
      "name": "input_tokens",
      "rate": "20.00",
      "per": "1000000",
      "unit": "token",
      "conditions": {
        "service_tier": [
          "fast",
          "priority"
        ],
        "long_context": {
          "usage": "total_input_tokens",
          "above": "272000",
          "rate": "40.00"
        }
      }
    },
    {
      "name": "cached_tokens",
      "rate": "2.00",
      "per": "1000000",
      "unit": "token",
      "conditions": {
        "service_tier": [
          "fast",
          "priority"
        ],
        "long_context": {
          "usage": "total_input_tokens",
          "above": "272000",
          "rate": "4.00"
        }
      }
    },
    {
      "name": "cache_write_tokens",
      "rate": "25.00",
      "per": "1000000",
      "unit": "token",
      "conditions": {
        "service_tier": [
          "fast",
          "priority"
        ],
        "long_context": {
          "usage": "total_input_tokens",
          "above": "272000",
          "rate": "50.00"
        }
      }
    },
    {
      "name": "output_tokens",
      "rate": "100.00",
      "per": "1000000",
      "unit": "token",
      "conditions": {
        "service_tier": [
          "fast",
          "priority"
        ],
        "long_context": {
          "usage": "total_input_tokens",
          "above": "272000",
          "rate": "150.00"
        }
      }
    }
  ],
  "calculation": {
    "usage": {
      "input_tokens": "1000",
      "cached_tokens": "0",
      "cache_write_tokens": "0",
      "output_tokens": "0"
    },
    "formula": "1000 * 20.00 / 1000000",
    "calculated_cost": "0.02",
    "provider_reported_cost": null,
    "evidence_kind": "synthetic"
  },
  "differences": [],
  "limitations": [
    "Posted Fast prices; account applicability and provider-backed acceptance remain outstanding.",
    "Unexpected served tiers, regional endpoints and hosted tools are not covered."
  ]
}
