{
  "schema_version": 1,
  "status": "verified",
  "identity": {
    "vendor": "openai",
    "api_product": "OpenAI direct API Flex",
    "upstream_model": "gpt-5.4",
    "aliases": [
      "gpt-5.4"
    ],
    "account_context": null,
    "region": "global",
    "routes": [
      "completion",
      "responses"
    ]
  },
  "sources": [
    {
      "url": "https://developers.openai.com/api/docs/pricing",
      "retrieved_at": "2026-09-16T00:00:00Z",
      "scope": "pricing",
      "excerpt": ""
    },
    {
      "url": "https://developers.openai.com/api/docs/models/gpt-5.4",
      "retrieved_at": "2026-09-16T00:00:00Z",
      "scope": "usage_schema",
      "excerpt": ""
    }
  ],
  "retrieved_at": "2026-09-16T00:00:00Z",
  "effective_from": null,
  "effective_to": null,
  "currency": "USD",
  "rate_basis": "posted_api_rate",
  "dimensions": [
    {
      "name": "input_tokens",
      "rate": "1.25",
      "per": "1000000",
      "unit": "token",
      "conditions": {
        "service_tier": [
          "flex"
        ],
        "long_context": {
          "usage": "total_input_tokens",
          "above": "272000",
          "rate": "2.50"
        }
      }
    },
    {
      "name": "cached_tokens",
      "rate": "0.13",
      "per": "1000000",
      "unit": "token",
      "conditions": {
        "service_tier": [
          "flex"
        ],
        "long_context": {
          "usage": "total_input_tokens",
          "above": "272000",
          "rate": "0.25"
        }
      }
    },
    {
      "name": "output_tokens",
      "rate": "7.50",
      "per": "1000000",
      "unit": "token",
      "conditions": {
        "service_tier": [
          "flex"
        ],
        "long_context": {
          "usage": "total_input_tokens",
          "above": "272000",
          "rate": "11.25"
        }
      }
    }
  ],
  "calculation": {
    "usage": {
      "input_tokens": "1000",
      "cached_tokens": "0",
      "output_tokens": "0"
    },
    "formula": "1000 * 1.25 / 1000000",
    "calculated_cost": "0.00125",
    "provider_reported_cost": null,
    "evidence_kind": "synthetic"
  },
  "differences": [],
  "limitations": [
    "Posted Flex prices; account applicability and provider-backed acceptance remain outstanding.",
    "Unexpected served tiers, regional endpoints and hosted tools are not covered."
  ]
}
