{
  "schema_version": 1,
  "status": "verified",
  "identity": {
    "vendor": "typesafe",
    "api_product": "TypeSafe System One direct API",
    "upstream_model": "jev-1.13.0",
    "aliases": [
      "jev-1.13.0"
    ],
    "account_context": null,
    "region": null,
    "routes": [
      "decisions"
    ]
  },
  "sources": [
    {
      "url": "https://docs.typesafe.ai/models",
      "retrieved_at": "2026-09-22T16:43:45Z",
      "scope": "pricing",
      "excerpt": "Charged per input token. Output tokens are free."
    },
    {
      "url": "https://docs.typesafe.ai/api",
      "retrieved_at": "2026-09-22T16:43:45Z",
      "scope": "usage_schema",
      "excerpt": "Token usage for the request."
    }
  ],
  "retrieved_at": "2026-09-22T16:43:45Z",
  "effective_from": null,
  "effective_to": null,
  "currency": "USD",
  "rate_basis": "posted_api_rate",
  "dimensions": [
    {
      "name": "input_tokens",
      "unit": "token",
      "rate": "0.042",
      "per": "1000000",
      "conditions": {}
    },
    {
      "name": "output_tokens",
      "unit": "token",
      "rate": "0",
      "per": "1000000",
      "conditions": {}
    }
  ],
  "calculation": {
    "usage": {
      "input_tokens": "1000",
      "output_tokens": "20"
    },
    "formula": "1000 * 0.042 / 1000000 + 20 * 0 / 1000000",
    "calculated_cost": "0.000042",
    "provider_reported_cost": null,
    "evidence_kind": "synthetic"
  },
  "differences": [],
  "limitations": [
    "The provider does not publish a historical effective date; the Gateway profile start is prospective and not a claim about historical prices.",
    "Public API pricing does not verify negotiated account rates or invoice reconciliation.",
    "No paid acceptance call or deployed Gateway verification has been performed for this evidence report.",
    "Missing usage and zero input-token totals remain unresolved, not inferred free."
  ]
}
